{
  "schema_version": "1.0",
  "job_id": "018f6c01-1a11-7301-4b5c-8d6e7f8a9b01",
  "task_id": "018f6b38-3a66-7106-4d7e-0e3c8b6a2c53",
  "type": "search",
  "status": "running",
  "progress": { "percent": 40, "stage": "fetching page 2" },
  "checkpoint": { "last_page": 1 },
  "created_at": "2026-01-15T09:06:00Z",
  "updated_at": "2026-01-15T09:07:00Z"
}
